{
  "title": "binary search எவ்வாறு செயல்படுகிறது",
  "level": "beginner",
  "language": "ta",
  "scenes": [
    {
      "type": "title_card",
      "heading": "binary search எவ்வாறு செயல்படுகிறது",
      "subheading": "ஒரு sorted list இல் ஒரு item வேகத்தைக் கண்டறியவும்",
      "narration": "வரவேற்கிறேன்! இன்று நாம் binary search ஐக் கற்றுக்கொள்வோம். இது ஒரு sorted list இல் ஒரு item ஐ மிக விரைவாகக் காண்கிறது."
    },
    {
      "type": "diagram",
      "heading": "ஒவ்வொரு முறையும் list ஐ பாதியாக வைக்கவும்",
      "layout": "stack",
      "items": [
        "16 sorted எண்கள்",
        "8 இடது",
        "4 இடது",
        "2 இடது",
        "கண்டுபிடித்துவிட்டனர்!"
      ],
      "arrows": [
        {
          "from": 0,
          "to": 1,
          "label": "பாதி"
        },
        {
          "from": 1,
          "to": 2,
          "label": "பாதி"
        },
        {
          "from": 2,
          "to": 3,
          "label": "பாதி"
        },
        {
          "from": 3,
          "to": 4,
          "label": "சரிபார்க்கவும்"
        }
      ],
      "narration": "16 sorted எண்களுடன் தொடங்குங்கள். ஒவ்வொரு காசோலையும் நடுவில் பார்த்து, நம் எண்ணை வைத்திருக்க முடியாத பாதியைக் குறைக்கிறது. எனவே 16 என்பது 8 ஆகி, பின்னர் 4 ஆகி, பின்னர் 2 ஆகி, பின்னர் அதைக் கண்டுபிடிப்போம்!"
    },
    {
      "type": "code_walkthrough",
      "heading": "Binary search இல் Python",
      "code": "def binary_search(items, target):\n    low, high = 0, len(items) - 1\n    while low <= high:\n        mid = (low + high) // 2\n        if items[mid] == target:\n            return mid\n        if items[mid] < target:\n            low = mid + 1\n        else:\n            high = mid - 1\n    return -1",
      "language_hint": "python",
      "highlight_lines": [
        4,
        6,
        8
      ],
      "narration": "முதலில் நாம் mid ஐ உருவாக்குகிறோம், நாம் இன்னும் தேடும் பகுதியின் நடுவில். mid இல் உள்ள item என்பது target க்கு சமமாக இருந்தால், நாம் mid ஐத் திருப்பித் தருகிறோம். இது மிகவும் சிறியதாக இருந்தால், நாம் மீண்டும் குறைந்த கடந்த mid மற்றும் loop ஐ நகர்த்துகிறோம்."
    },
    {
      "type": "title_card",
      "heading": "மறுபரிசீலனை",
      "subheading": "நடுவில் சரிபார்க்கவும், பாதியை இடவும், மீண்டும் செய்யவும்",
      "narration": "மறுபரிசீலனை செய்ய, binary search நடுத்தரத்தை சரிபார்த்து ஒவ்வொரு முறையும் பாதியை எறிகிறார். ஒரு மில்லியன் items இல் ஒரு list க்கு கூட சுமார் இருபது காசோலைகள் மட்டுமே தேவைப்படுகின்றன. நினைவில் கொள்ளுங்கள், list முதலில் sorted ஆக இருக்க வேண்டும்!"
    }
  ]
}