{
  "title": "Python loop எப்படி வேலை செய்யுது",
  "level": "beginner",
  "language": "ta",
  "scenes": [
    {
      "type": "title_card",
      "heading": "Python loop எப்படி வேலை செய்யுது",
      "subheading": "ஒரே code-ஐ திரும்ப எழுதாமலே வேலையைத் திரும்பச் செய்யலாம்",
      "narration": "வணக்கம்! இன்னைக்கு Python-ல loop எப்படி வேலை செய்யுதுன்னு பார்ப்போம். ஒரே வேலையைத் திரும்பத் திரும்பச் செய்ய loop உதவுது, அதனால ஒரே code-ஐ பல தடவை எழுத வேண்டியதில்லை."
    },
    {
      "type": "code_walkthrough",
      "heading": "for loop",
      "code": "for i in range(3):\n    print(i)",
      "language_hint": "python",
      "highlight_lines": [1, 2],
      "narration": "இது ஒரு சின்ன for loop. range(3) நமக்கு 0, 1, 2-ன்னு மூணு எண்களைக் கொடுக்குது. ஒவ்வொரு எண்ணும் variable i-க்குள்ள போகுது, print அதை screen-ல காட்டுது."
    },
    {
      "type": "diagram",
      "heading": "Loop எப்படி ஓடுது",
      "layout": "row",
      "items": ["i = 0", "i = 1", "i = 2"],
      "arrows": [
        { "from": 0, "to": 1, "label": "அடுத்து" },
        { "from": 1, "to": 2, "label": "அடுத்து" }
      ],
      "narration": "Loop எப்படி ஓடுதுன்னு பாருங்க. முதல்ல i 0-ஆ இருக்கு, print 0-ன்னு காட்டுது. அப்புறம் i 1 ஆகுது, அடுத்து 2 ஆகுது, அதுக்கப்புறம் loop நின்னுடுது."
    },
    {
      "type": "title_card",
      "heading": "சுருக்கம்",
      "subheading": "ஒவ்வொரு மதிப்புக்கும் loop அதே code-ஐ திரும்ப ஓட்டுது",
      "narration": "சுருக்கமா சொன்னா, ஒவ்வொரு மதிப்புக்கும் loop அதே code-ஐ திரும்ப ஓட்டுது. எத்தனை தடவைன்னு range சொல்லுது, ஒவ்வொரு விடையையும் print காட்டுது. இப்போ range-க்குள்ள இருக்கிற எண்ணை மாத்தி நீங்களே முயற்சி பண்ணுங்க!"
    }
  ],
  "quiz": [
    {
      "question": "range(3) loop-க்கு எந்த எண்களைக் கொடுக்குது?",
      "options": [
        "1, 2, 3",
        "0, 1, 2",
        "3 மட்டும்",
        "0, 1, 2, 3"
      ],
      "answer_index": 1,
      "explanation": "range(3) 0-ல ஆரம்பிச்சு 3-க்கு முன்னாடியே நின்னுடும், அதனால 0, 1, 2 கொடுக்குது."
    },
    {
      "question": "loop-க்குள்ள print(i) என்ன செய்யுது?",
      "options": [
        "i-யோட மதிப்பை screen-ல காட்டுது",
        "loop-ஐ நிறுத்துது",
        "i-ல 1 கூட்டுது",
        "i-ஐ file-ல save பண்ணுது"
      ],
      "answer_index": 0,
      "explanation": "loop ஒவ்வொரு தடவை ஓடும்போதும், print அப்போ இருக்கிற i-யோட மதிப்பை screen-ல காட்டுது."
    },
    {
      "question": "நாம ஏன் loop use பண்றோம்?",
      "options": [
        "computer வேகமா ஓடறதுக்கு",
        "ஒரே code-ஐ பல தடவை எழுதறதுக்கு",
        "அதே code-ஐ திரும்ப எழுதாம வேலையைத் திரும்பச் செய்யறதுக்கு",
        "எண்களோட list-ஐ வரிசைப்படுத்தறதுக்கு"
      ],
      "answer_index": 2,
      "explanation": "ஒவ்வொரு மதிப்புக்கும் loop அதே code-ஐ திரும்ப ஓட்டுது, அதனால அதை ஒரு தடவை எழுதினா போதும்."
    }
  ]
}
