{
  "title": "photosynthesis எவ்வாறு செயல்படுகிறது",
  "level": "beginner",
  "language": "ta",
  "scenes": [
    {
      "type": "title_card",
      "heading": "photosynthesis எவ்வாறு செயல்படுகிறது",
      "subheading": "தாவரங்கள் ஒளியை உணவாக மாற்றுவது எப்படி?",
      "narration": "வரவேற்கிறேன்! இன்று நாம் photosynthesis எவ்வாறு செயல்படுகிறது என்பதைக் கற்றுக்கொள்வோம். பச்சை தாவரங்கள் சூரிய ஒளியிலிருந்து தங்கள் சொந்த உணவை உருவாக்குவது இப்படித்தான்."
    },
    {
      "type": "diagram",
      "heading": "ஒரு தாவரத்திற்கு என்ன தேவை?",
      "layout": "row",
      "items": [
        "சூரிய ஒளி",
        "தண்ணீர்",
        "கார்பன் டை ஆக்சைடு"
      ],
      "narration": "ஒரு தாவரத்திற்கு மூன்று பொருட்கள் தேவை. முதலாவதாக, சூரியனில் இருந்து வரும் ஒளி. இரண்டாவதாக, மண்ணில் இருந்து தண்ணீர், மூன்றாவதாக, காற்றில் இருந்து carbon dioxide."
    },
    {
      "type": "diagram",
      "heading": "காற்று சுழற்சி",
      "layout": "cycle",
      "items": [
        "தாவரங்கள் CO2 ஐ எடுத்துக்கொள்கின்றன",
        "Plants make oxygen",
        "விலங்குகள் சுவாசிக்கின்றன oxygen",
        "விலங்குகள் சுவாசிக்கின்றன CO2"
      ],
      "arrows": [
        {
          "from": 0,
          "to": 1,
          "label": "ஒளியுடன்"
        },
        {
          "from": 1,
          "to": 2
        },
        {
          "from": 2,
          "to": 3
        },
        {
          "from": 3,
          "to": 0
        }
      ],
      "narration": "இலைக்குள், பச்சை chlorophyll சூரிய ஒளியைப் பயன்படுத்தி carbon dioxide ஐ தாவரத்தின் உணவாக glucose ஆக மாற்றுகிறது. இது விலங்குகள் மற்றும் மக்கள் சுவாசிக்கும் oxygen ஐ உருவாக்குகிறது. நாம் carbon dioxide ஐ சுவாசிக்கிறோம், தாவரங்கள் அதை மீண்டும் எடுத்துக்கொள்கின்றன, எனவே சுழற்சி தொடர்கிறது."
    },
    {
      "type": "title_card",
      "heading": "மறுபரிசீலனை",
      "subheading": "சூரிய ஒளி, நீர் மற்றும் காற்று உணவாக மாறுகின்றன",
      "narration": "மறுபரிசீலனை செய்ய, தாவரங்கள் சூரிய ஒளி, நீர் மற்றும் glucose ஐ உருவாக்க carbon dioxide ஐப் பயன்படுத்துகின்றன. நாம் சுவாசிக்கும் oxygen ஐ அவை நமக்கு வழங்குகின்றன. அடுத்த முறை நீங்கள் ஒரு பச்சை இலையைப் பார்க்கும்போது, photosynthesis ஐ நினைவில் கொள்ளுங்கள்!"
    }
  ]
}