{
  "title": "Pythagorean theorem",
  "level": "beginner",
  "language": "ta",
  "scenes": [
    {
      "type": "title_card",
      "heading": "Pythagorean theorem",
      "subheading": "செங்கோண முக்கோணத்துக்கான ஒரு விதி",
      "narration": "வணக்கம்! இன்னைக்கு Pythagorean theorem பத்திப் பார்ப்போம். செங்கோண முக்கோணத்தோட பக்கங்கள் ஒண்ணோட ஒண்ணு எப்படித் தொடர்புடையதுன்னு இது சொல்லுது."
    },
    {
      "type": "diagram",
      "heading": "மூணு பக்கங்கள்",
      "layout": "row",
      "items": ["பக்கம் a", "பக்கம் b", "கர்ணம் c"],
      "narration": "செங்கோண முக்கோணத்துல ஒரு மூலை நேர் கோணமா இருக்கும், மொத்தம் மூணு பக்கங்கள் இருக்கும். ரெண்டு சின்னப் பக்கங்களை a, b-ன்னு சொல்றோம். நேர் கோணத்துக்கு எதிர்ல இருக்கிற நீளமான பக்கம்தான் கர்ணம் c."
    },
    {
      "type": "diagram",
      "heading": "விதி",
      "layout": "row",
      "items": ["a-யோட வர்க்கம்", "b-யோட வர்க்கம்", "c-யோட வர்க்கம்"],
      "arrows": [
        { "from": 0, "to": 1, "label": "கூட்டு" },
        { "from": 1, "to": 2, "label": "சமம்" }
      ],
      "narration": "விதி ரொம்ப எளிது. பக்கம் a-யோட வர்க்கத்தையும், பக்கம் b-யோட வர்க்கத்தையும் கூட்டுங்க. அந்தக் கூட்டுத்தொகை c-யோட வர்க்கத்துக்குச் சமமா இருக்கும்."
    },
    {
      "type": "title_card",
      "heading": "எடுத்துக்காட்டும் சுருக்கமும்",
      "subheading": "9 + 16 = 25",
      "narration": "3, 4 பக்கங்கள் இருக்கிற ஒரு முக்கோணத்தை எடுத்துக்கோங்க. 9 கூட்டல் 16, 25 ஆகுது, அதனால c 5. இப்போ எந்த செங்கோண முக்கோணத்துலயும் தெரியாத பக்கத்தைக் கண்டுபிடிக்கலாம்!"
    }
  ]
}
