{
  "title": "binary search कैसे काम करता है",
  "level": "beginner",
  "language": "hi",
  "scenes": [
    {
      "type": "title_card",
      "heading": "binary search कैसे काम करता है",
      "subheading": "sorted list में कोई item जल्दी ढूंढें",
      "narration": "नमस्ते! आज हम binary search सीखेंगे। यह sorted list में कोई भी item बहुत जल्दी ढूंढ लेता है।"
    },
    {
      "type": "diagram",
      "heading": "हर बार list को आधा करें",
      "layout": "stack",
      "items": [
        "16 sorted संख्याएँ",
        "8 बचीं",
        "4 बचीं",
        "2 बचीं",
        "मिल गया!"
      ],
      "arrows": [
        {
          "from": 0,
          "to": 1,
          "label": "आधा करो"
        },
        {
          "from": 1,
          "to": 2,
          "label": "आधा करो"
        },
        {
          "from": 2,
          "to": 3,
          "label": "आधा करो"
        },
        {
          "from": 3,
          "to": 4,
          "label": "जाँचो"
        }
      ],
      "narration": "मान लीजिए हमारे पास 16 sorted संख्याएँ हैं। हर बार हम बीच वाली संख्या देखते हैं और वह आधा हिस्सा छोड़ देते हैं जिसमें हमारी संख्या हो ही नहीं सकती। इस तरह 16 से 8, फिर 4, फिर 2 संख्याएँ बचती हैं, और आखिर में हमारी संख्या मिल जाती है!"
    },
    {
      "type": "code_walkthrough",
      "heading": "Python में binary search",
      "code": "def binary_search(items, target):\n    low, high = 0, len(items) - 1\n    while low <= high:\n        mid = (low + high) // 2\n        if items[mid] == target:\n            return mid\n        if items[mid] < target:\n            low = mid + 1\n        else:\n            high = mid - 1\n    return -1",
      "language_hint": "python",
      "highlight_lines": [
        4,
        6,
        8
      ],
      "narration": "सबसे पहले हम mid निकालते हैं, यानी उस हिस्से का बीच जिसमें अभी खोज बाकी है। अगर mid वाला item, target के बराबर है, तो हम mid return कर देते हैं। अगर वह छोटा है, तो हम low को mid के आगे ले जाते हैं और loop फिर से चलता है।"
    },
    {
      "type": "title_card",
      "heading": "सारांश",
      "subheading": "बीच देखो, आधा छोड़ो, दोहराओ",
      "narration": "संक्षेप में, binary search हर बार बीच वाला item देखता है और आधी list छोड़ देता है। दस लाख items वाली list में भी लगभग बीस बार देखना काफ़ी होता है। बस याद रखिए, list पहले से sorted होनी चाहिए!"
    }
  ]
}
