{
  "title": "Pythagorean theorem",
  "level": "beginner",
  "language": "hi",
  "scenes": [
    {
      "type": "title_card",
      "heading": "Pythagorean theorem",
      "subheading": "समकोण त्रिभुज का एक नियम",
      "narration": "नमस्ते! आज हम Pythagorean theorem सीखेंगे। यह बताता है कि समकोण त्रिभुज की भुजाएँ आपस में कैसे जुड़ी हैं।"
    },
    {
      "type": "diagram",
      "heading": "तीन भुजाएँ",
      "layout": "row",
      "items": ["भुजा a", "भुजा b", "कर्ण c"],
      "narration": "समकोण त्रिभुज में एक कोना सीधा होता है और तीन भुजाएँ होती हैं। दो छोटी भुजाओं को a और b कहते हैं। सबसे लंबी भुजा, जो सीधे कोने के सामने होती है, कर्ण c कहलाती है।"
    },
    {
      "type": "diagram",
      "heading": "नियम",
      "layout": "row",
      "items": ["a का वर्ग", "b का वर्ग", "c का वर्ग"],
      "arrows": [
        { "from": 0, "to": 1, "label": "जोड़ें" },
        { "from": 1, "to": 2, "label": "बराबर" }
      ],
      "narration": "नियम बहुत सरल है। भुजा a का वर्ग लें, भुजा b का वर्ग लें और दोनों को जोड़ें। जवाब c के वर्ग के बराबर होता है।"
    },
    {
      "type": "title_card",
      "heading": "उदाहरण और सारांश",
      "subheading": "9 + 16 = 25",
      "narration": "3 और 4 भुजाओं वाला त्रिभुज लीजिए। 9 और 16 मिलकर 25 होते हैं, इसलिए c का मान 5 है। अब आप किसी भी समकोण त्रिभुज की छूटी हुई भुजा निकाल सकते हैं!"
    }
  ]
}
